{
  "$schema": "https://json-schema.org/draft/2020-12/schema",
  "$id": "https://ospp-standard.org/schemas/v1/mqtt/boot-notification-request.schema.json",
  "title": "BootNotificationRequest",
  "description": "Sent by a station to the server after boot to register itself, report firmware/hardware info, and declare capabilities.",
  "type": "object",
  "additionalProperties": false,
  "required": [
    "stationId",
    "firmwareVersion",
    "stationModel",
    "stationVendor",
    "serialNumber",
    "bays",
    "uptimeSeconds",
    "pendingOfflineTransactions",
    "timezone",
    "bootReason",
    "capabilities",
    "networkInfo"
  ],
  "properties": {
    "stationId": {
      "$ref": "../common/station-id.schema.json"
    },
    "firmwareVersion": {
      "type": "string",
      "pattern": "^\\d+\\.\\d+\\.\\d+$",
      "maxLength": 32,
      "description": "Semantic version of the station firmware."
    },
    "stationModel": {
      "type": "string",
      "minLength": 1,
      "maxLength": 128,
      "description": "Model identifier of the station hardware."
    },
    "stationVendor": {
      "type": "string",
      "minLength": 1,
      "maxLength": 128,
      "description": "Name of the station manufacturer."
    },
    "serialNumber": {
      "type": "string",
      "minLength": 1,
      "maxLength": 64,
      "description": "Unique serial number of the station unit."
    },
    "bays": {
      "type": "array",
      "minItems": 1,
      "maxItems": 64,
      "description": "The station's RE-DECLARED PHYSICAL TOPOLOGY — the same bays and program ordinals it declared at provisioning, restated on every boot so the server can detect that the two no longer agree. Labels are NOT re-declared and are NOT compared: they are descriptive (Chapter 04 — Protocol Flows §2), and comparing them would put a station into Pending for a corrected typo in a firmware constant. The declaration MUST be STABLE between boots while the hardware is unchanged; how firmware achieves that — NVS, a compiled-in table, a hardware scan — is its own business, and the contract is the stability, not the mechanism. A MISMATCH in either direction against the provisioned topology puts the station in Pending, NOT Rejected: Pending keeps the command channel open so an operator can repair the disagreement, and Rejected would remove the only channel through which it could be repaired (Chapter 05 — State Machines §1, station state machine). Provisioning creates the bays and boot never does, so a FIRST boot always matches unless the provisioning declaration and this one disagree — which is the same mismatch and the same Pending. A faulted bay or program is re-declared present-but-unavailable, never omitted: omission means the hardware changed and requires re-provisioning. At the 64-bay and 32-program maxima this field is under 8 KB, far below the 64 KB MQTT Maximum Packet Size of Chapter 02 — Transport §1.2.",
      "items": {
        "$ref": "../common/bay-topology.schema.json"
      }
    },
    "uptimeSeconds": {
      "type": "integer",
      "minimum": 0,
      "description": "Seconds elapsed since the station last booted."
    },
    "pendingOfflineTransactions": {
      "type": "integer",
      "minimum": 0,
      "description": "Number of offline transactions queued for synchronization."
    },
    "timezone": {
      "type": "string",
      "minLength": 1,
      "maxLength": 64,
      "description": "IANA timezone identifier of the station (e.g. 'Europe/London')."
    },
    "bootReason": {
      "type": "string",
      "enum": [
        "PowerOn",
        "Watchdog",
        "FirmwareUpdate",
        "RemoteReset",
        "ManualReset",
        "ScheduledReset",
        "ErrorRecovery",
        "Reconnect"
      ],
      "description": "Reason the station sent this BootNotification. SEVEN of the eight name an actual boot; `Reconnect` names the case where NONE occurred — the firmware never restarted. It covers TWO such cases: a re-dialled MQTT session, and a BootNotification the server asked for by TriggerMessage [MSG-016], where nothing restarted and the session is not new either. Its definition was narrowed to the first case until 0.31.0, which left a triggered Boot with no truthful member at all — the same bind `Reconnect` was invented to end. The enum is NOT widened: the member already meant *no boot occurred*, and that is exactly what a triggered Boot reports. OSPP requires a BootNotification after every connection including reconnections, so without `Reconnect` a station that merely re-dialled had to pick a value it knew to be false, and a server reading it could not tell whether the station's volatile state survived. It ends no live session on the server: a session ends on its station's end record or at the server's sweep (BootNotification profile §5.2). After `PowerOn`, `Watchdog`, `ErrorRecovery`, `Reconnect`, `ManualReset` or `ScheduledReset` the station may still hold a wash, which it resumes or ends at once with SessionEnded `Fault`; `RemoteReset` and `FirmwareUpdate` follow a reboot no session may run into. `RemoteReset` means the server asked for this return via Reset [MSG-015], distinguishing a commanded reboot from a spontaneous one. `ManualReset` is a human acting at the station; `ScheduledReset` is the station's own scheduled restart. No member denotes a credential wipe: OSPP has no remote factory reset (Reset profile §5.1). `uptimeSeconds` is the cross-check, and the two MUST agree: a `Reconnect` carries the uptime the station already had, and a station claiming `PowerOn` with a large uptime is detectably lying."
    },
    "capabilities": {
      "type": "object",
      "additionalProperties": false,
      "required": [
        "bleSupported",
        "offlineModeSupported",
        "meterValuesSupported"
      ],
      "properties": {
        "bleSupported": {
          "type": "boolean",
          "description": "Whether the station supports BLE communication."
        },
        "offlineModeSupported": {
          "type": "boolean",
          "description": "Whether the station supports offline session authorization."
        },
        "meterValuesSupported": {
          "type": "boolean",
          "description": "Whether the station supports reporting meter values."
        },
        "deviceManagementSupported": {
          "type": "boolean",
          "description": "Whether the station supports the Device Management profile (configuration, firmware update, diagnostics, remote commands)."
        }
      },
      "description": "Feature flags indicating station capabilities."
    },
    "networkInfo": {
      "type": "object",
      "additionalProperties": false,
      "required": [
        "connectionType"
      ],
      "properties": {
        "connectionType": {
          "type": "string",
          "enum": [
            "Ethernet",
            "Wifi",
            "Cellular"
          ],
          "description": "Type of network connection used by the station."
        },
        "signalStrength": {
          "type": [
            "integer",
            "null"
          ],
          "description": "Signal strength in dBm, or null if not applicable (e.g. Ethernet)."
        }
      },
      "description": "Current network connection details."
    },
    "messageSigningMode": {
      "type": "string",
      "enum": [
        "All",
        "None"
      ],
      "description": "DEPRECATED at 0.34.0 and RETAINED. Signing is unconditional (06-security.md 5.1), so the only conforming value is \"All\" and this field can no longer distinguish two legitimate states -- it distinguishes a conforming station from one whose every non-exempt message will be refused with 1013. It stays in this schema because removing a property from a closed object refuses the boot of every station already sending it, and stations do. A server MUST continue to accept it and MUST NOT infer anything from its absence. Removal is a later revision, after the field has fallen out of use.",
      "deprecated": true
    }
  }
}
