{
  "stationId": "stn_a1b2c3d4e5f6",
  "firmwareVersion": "1.2.3",
  "stationModel": "SSP-3000",
  "stationVendor": "AcmeCorp",
  "serialNumber": "ACME-SSP-20250187",
  "bays": [
    {
      "bayNumber": 1,
      "programNumbers": [
        1,
        2,
        3
      ]
    },
    {
      "bayNumber": 2,
      "programNumbers": [
        1,
        2,
        3
      ]
    },
    {
      "bayNumber": 3,
      "programNumbers": [
        1,
        2,
        3
      ]
    }
  ],
  "uptimeSeconds": 42,
  "pendingOfflineTransactions": 2,
  "timezone": "Europe/London",
  "bootReason": "PowerOn",
  "capabilities": {
    "bleSupported": true,
    "offlineModeSupported": true,
    "meterValuesSupported": true,
    "deviceManagementSupported": true
  },
  "networkInfo": {
    "connectionType": "Ethernet",
    "signalStrength": null
  }
}
