{
  "stationId": "stn_a1b2c3d4e5f6",
  "firmwareVersion": "1.0.0",
  "stationModel": "SSP-3000",
  "stationVendor": "AcmeCorp",
  "serialNumber": "SN-2024-001234",
  "bays": [
    {
      "bayNumber": 1,
      "programNumbers": [
        1,
        2,
        3
      ]
    },
    {
      "bayNumber": 2,
      "programNumbers": [
        1,
        2,
        3
      ]
    }
  ],
  "uptimeSeconds": 0,
  "pendingOfflineTransactions": 0,
  "timezone": "Europe/London",
  "bootReason": "PowerOn",
  "capabilities": {
    "bleSupported": true,
    "offlineModeSupported": false,
    "meterValuesSupported": true
  },
  "networkInfo": {
    "connectionType": "Ethernet"
  }
}
