{
  "stationId": "stn_e5f6a7b8c9d0",
  "firmwareVersion": "2.3.1",
  "stationModel": "SSP-3000",
  "stationVendor": "AcmeCorp",
  "serialNumber": "SN-2025-007890",
  "bays": [
    {
      "bayNumber": 1,
      "programNumbers": [
        1,
        2,
        3
      ]
    },
    {
      "bayNumber": 2,
      "programNumbers": [
        1,
        2,
        3
      ]
    }
  ],
  "uptimeSeconds": 86595,
  "pendingOfflineTransactions": 3,
  "timezone": "Europe/London",
  "bootReason": "Reconnect",
  "capabilities": {
    "bleSupported": true,
    "offlineModeSupported": true,
    "meterValuesSupported": true
  },
  "networkInfo": {
    "connectionType": "Cellular",
    "signalStrength": -78
  }
}
